{
  "schema_version": "0.2",
  "window_id": "sim-device-01-session-01-shake-014-window-000",
  "source_trial_id": "sim-device-01-session-01-shake-014",
  "device_id": "sim-device-01",
  "session_id": "sim-device-01-session-01",
  "trial_id": "sim-device-01-session-01-shake-014",
  "split": "train",
  "sequence_number": 0,
  "label": "shake",
  "coordinate_frame": "unity_device_origin",
  "target_sample_rate_hz": 60,
  "window_start_ns": 4000000000,
  "window_end_ns": 6000000040,
  "samples": [
    {
      "sample_index": 0,
      "capture_time_ns": 4000000000,
      "position_m": [
        0.00032207,
        0.00014851,
        -0.00015449
      ],
      "orientation_xyzw": [
        0.0,
        0.0,
        0.0,
        1.0
      ],
      "tracking_valid": true
    },
    {
      "sample_index": 1,
      "capture_time_ns": 4016666667,
      "position_m": [
        0.00143775,
        0.00119006,
        0.00051499
      ],
      "orientation_xyzw": [
        0.0,
        0.00921091,
        0.0,
        0.99995758
      ],
      "tracking_valid": true
    },
    {
      "sample_index": 2,
      "capture_time_ns": 4033333334,
      "position_m": [
        3.72e-05,
        0.00097795,
        -0.00036387
      ],
      "orientation_xyzw": [
        0.0,
        0.01839536,
        0.0,
        0.99983079
      ],
      "tracking_valid": true
    },
    {
      "sample_index": 3,
      "capture_time_ns": 4050000001,
      "position_m": [
        -0.00015818,
        -0.00034776,
        -0.00163413
      ],
      "orientation_xyzw": [
        0.0,
        0.02752701,
        0.0,
        0.99962106
      ],
      "tracking_valid": true
    },
    {
      "sample_index": 4,
      "capture_time_ns": 4066666668,
      "position_m": [
        -0.00024991,
        0.00155897,
        -0.00067625
      ],
      "orientation_xyzw": [
        0.0,
        0.03657968,
        0.0,
        0.99933074
      ],
      "tracking_valid": true
    },
    {
      "sample_index": 5,
      "capture_time_ns": 4083333335,
      "position_m": [
        0.00191036,
        -0.00056089,
        2.224e-05
      ],
      "orientation_xyzw": [
        0.0,
        0.04552748,
        0.0,
        0.99896309
      ],
      "tracking_valid": true
    },
    {
      "sample_index": 6,
      "capture_time_ns": 4100000002,
      "position_m": [
        0.00094083,
        0.00127398,
        -0.00142938
      ],
      "orientation_xyzw": [
        0.0,
        0.05434488,
        0.0,
        0.99852223
      ],
      "tracking_valid": true
    },
    {
      "sample_index": 7,
      "capture_time_ns": 4116666669,
      "position_m": [
        0.0025126,
        -0.00048249,
        1.059e-05
      ],
      "orientation_xyzw": [
        0.0,
        0.0630068,
        0.0,
        0.9980131
      ],
      "tracking_valid": true
    },
    {
      "sample_index": 8,
      "capture_time_ns": 4133333336,
      "position_m": [
        0.0011137,
        0.00037399,
        0.00055366
      ],
      "orientation_xyzw": [
        0.0,
        0.0714887,
        0.0,
        0.99744141
      ],
      "tracking_valid": true
    },
    {
      "sample_index": 9,
      "capture_time_ns": 4150000003,
      "position_m": [
        0.0024736,
        -0.00119063,
        -0.00038868
      ],
      "orientation_xyzw": [
        0.0,
        0.07976665,
        0.0,
        0.99681356
      ],
      "tracking_valid": true
    },
    {
      "sample_index": 10,
      "capture_time_ns": 4166666670,
      "position_m": [
        0.00322304,
        -0.00010295,
        -0.00042352
      ],
      "orientation_xyzw": [
        0.0,
        0.08781741,
        0.0,
        0.99613659
      ],
      "tracking_valid": true
    },
    {
      "sample_index": 11,
      "capture_time_ns": 4183333337,
      "position_m": [
        0.00259028,
        0.00039735,
        0.00022825
      ],
      "orientation_xyzw": [
        0.0,
        0.09561848,
        0.0,
        0.99541806
      ],
      "tracking_valid": true
    },
    {
      "sample_index": 12,
      "capture_time_ns": 4200000004,
      "position_m": [
        0.00230043,
        -0.00010461,
        0.0002476
      ],
      "orientation_xyzw": [
        0.0,
        0.10314819,
        0.0,
        0.994666
      ],
      "tracking_valid": true
    },
    {
      "sample_index": 13,
      "capture_time_ns": 4216666671,
      "position_m": [
        0.00209188,
        -8.946e-05,
        0.00043992
      ],
      "orientation_xyzw": [
        0.0,
        0.11038576,
        0.0,
        0.99388882
      ],
      "tracking_valid": true
    },
    {
      "sample_index": 14,
      "capture_time_ns": 4233333338,
      "position_m": [
        0.00162304,
        -0.00023667,
        -0.00017312
      ],
      "orientation_xyzw": [
        0.0,
        0.11731132,
        0.0,
        0.99309519
      ],
      "tracking_valid": true
    },
    {
      "sample_index": 15,
      "capture_time_ns": 4250000005,
      "position_m": [
        0.00322342,
        0.00124155,
        -0.00151619
      ],
      "orientation_xyzw": [
        0.0,
        0.12390599,
        0.0,
        0.99229396
      ],
      "tracking_valid": true
    },
    {
      "sample_index": 16,
      "capture_time_ns": 4266666672,
      "position_m": [
        0.00225327,
        -0.00108556,
        -0.0015593
      ],
      "orientation_xyzw": [
        0.0,
        0.1301519,
        0.0,
        0.99149407
      ],
      "tracking_valid": true
    },
    {
      "sample_index": 17,
      "capture_time_ns": 4283333339,
      "position_m": [
        0.00356293,
        0.00115382,
        -0.00035984
      ],
      "orientation_xyzw": [
        0.0,
        0.13603226,
        0.0,
        0.99070441
      ],
      "tracking_valid": true
    },
    {
      "sample_index": 18,
      "capture_time_ns": 4300000006,
      "position_m": [
        0.00250377,
        -0.0002933,
        -0.00072141
      ],
      "orientation_xyzw": [
        0.0,
        0.14153134,
        0.0,
        0.98993377
      ],
      "tracking_valid": true
    },
    {
      "sample_index": 19,
      "capture_time_ns": 4316666673,
      "position_m": [
        0.00393877,
        -0.00042176,
        0.00030464
      ],
      "orientation_xyzw": [
        0.0,
        0.14663455,
        0.0,
        0.98919073
      ],
      "tracking_valid": true
    },
    {
      "sample_index": 20,
      "capture_time_ns": 4333333340,
      "position_m": [
        0.00433989,
        -8.294e-05,
        0.00083559
      ],
      "orientation_xyzw": [
        0.0,
        0.15132842,
        0.0,
        0.98848354
      ],
      "tracking_valid": true
    },
    {
      "sample_index": 21,
      "capture_time_ns": 4350000007,
      "position_m": [
        0.00427128,
        0.00082796,
        0.00062067
      ],
      "orientation_xyzw": [
        0.0,
        0.15560064,
        0.0,
        0.98782005
      ],
      "tracking_valid": true
    },
    {
      "sample_index": 22,
      "capture_time_ns": 4366666674,
      "position_m": [
        0.0017698,
        -0.00044503,
        -0.00023075
      ],
      "orientation_xyzw": [
        0.0,
        0.15944008,
        0.0,
        0.98720761
      ],
      "tracking_valid": true
    },
    {
      "sample_index": 23,
      "capture_time_ns": 4383333341,
      "position_m": [
        0.00354844,
        0.00020296,
        0.00075029
      ],
      "orientation_xyzw": [
        0.0,
        0.16283679,
        0.0,
        0.98665302
      ],
      "tracking_valid": true
    },
    {
      "sample_index": 24,
      "capture_time_ns": 4400000008,
      "position_m": [
        0.00249175,
        -0.00149208,
        -0.0007261
      ],
      "orientation_xyzw": [
        0.0,
        0.16578202,
        0.0,
        0.98616242
      ],
      "tracking_valid": true
    },
    {
      "sample_index": 25,
      "capture_time_ns": 4416666675,
      "position_m": [
        0.00333126,
        0.00069307,
        0.00061376
      ],
      "orientation_xyzw": [
        0.0,
        0.16826819,
        0.0,
        0.98574125
      ],
      "tracking_valid": true
    },
    {
      "sample_index": 26,
      "capture_time_ns": 4433333342,
      "position_m": [
        0.0048284,
        -0.00012714,
        -0.00016912
      ],
      "orientation_xyzw": [
        0.0,
        0.17028896,
        0.0,
        0.98539417
      ],
      "tracking_valid": true
    },
    {
      "sample_index": 27,
      "capture_time_ns": 4450000009,
      "position_m": [
        0.00437094,
        -2.69e-06,
        -0.00131376
      ],
      "orientation_xyzw": [
        0.0,
        0.17183918,
        0.0,
        0.98512501
      ],
      "tracking_valid": true
    },
    {
      "sample_index": 28,
      "capture_time_ns": 4466666676,
      "position_m": [
        0.00276614,
        0.00016443,
        -0.00053936
      ],
      "orientation_xyzw": [
        0.0,
        0.17291491,
        0.0,
        0.98493677
      ],
      "tracking_valid": true
    },
    {
      "sample_index": 29,
      "capture_time_ns": 4483333343,
      "position_m": [
        0.00394131,
        0.00072394,
        -0.0002251
      ],
      "orientation_xyzw": [
        0.0,
        0.17351343,
        0.0,
        0.9848315
      ],
      "tracking_valid": true
    },
    {
      "sample_index": 30,
      "capture_time_ns": 4500000010,
      "position_m": [
        0.00334777,
        -0.00164851,
        3.442e-05
      ],
      "orientation_xyzw": [
        0.0,
        0.1736332,
        0.0,
        0.98481039
      ],
      "tracking_valid": true
    },
    {
      "sample_index": 31,
      "capture_time_ns": 4516666677,
      "position_m": [
        0.00331908,
        -0.0002178,
        -0.00027332
      ],
      "orientation_xyzw": [
        0.0,
        0.17327395,
        0.0,
        0.98487367
      ],
      "tracking_valid": true
    },
    {